{
  "schema_version": 1,
  "byte_policy": "utf8-no-bom-lf-v1",
  "core": "core",
  "modules": [
    {
      "id": "core",
      "path": "shared/forge-procedure-core.md",
      "sha256": "9c8a97fba438123de5f2f93d4e32ed9ff924a372e8501c1fd52cb4ce09361f3c",
      "status": "ready",
      "owner": "T01",
      "dependencies": [],
      "preconditions": [
        "Trusted caller has resolved phase and physical project/install root"
      ],
      "postconditions": [
        "Common scope, authority, gates and publication obligations included exactly once"
      ],
      "tests": [
        "scripts/forge-procedure-context.test.js"
      ]
    },
    {
      "id": "personal",
      "path": "shared/forge-procedure-personal.md",
      "sha256": null,
      "status": "pending",
      "owner": "T04",
      "dependencies": [
        "core"
      ],
      "preconditions": [
        "Read-only personal snapshot and explicit own-work selection",
        "Preserve accepted decisions and unresolved personal diagnostics"
      ],
      "postconditions": [
        "Only the selected own unit advances; no colleague discovery or implicit binding"
      ],
      "tests": [
        "scripts/forge-procedure-callers.test.js"
      ]
    },
    {
      "id": "planning",
      "path": "shared/forge-procedure-planning.md",
      "sha256": "f2eb17357b97fd39a35bb4c1b7dca22c91f133ea317a5554ab94e60863cb621c",
      "status": "ready",
      "owner": "T02",
      "dependencies": [
        "core"
      ],
      "preconditions": [
        "Matching scope, decisions and research are available",
        "Required functional decisions have explicit answers before dependent planning"
      ],
      "postconditions": [
        "Phase-specific artifacts and full must-haves pass the applicable plan gate"
      ],
      "tests": [
        "scripts/forge-prompt.test.js"
      ]
    },
    {
      "id": "task-preparation",
      "path": "shared/forge-procedure-task-preparation.md",
      "sha256": null,
      "status": "pending",
      "owner": "T03",
      "dependencies": [
        "core"
      ],
      "preconditions": [
        "Standalone task identity and phase are validated by phaseContract",
        "Required decisions remain pending by stable ID"
      ],
      "postconditions": [
        "Only the selected task phase artifact is returned for owner publication"
      ],
      "tests": [
        "scripts/forge-task-preparation.test.js"
      ]
    },
    {
      "id": "execution",
      "path": "shared/forge-procedure-execution.md",
      "sha256": null,
      "status": "pending",
      "owner": "T03",
      "dependencies": [
        "core"
      ],
      "preconditions": [
        "Complete plan, security and plan gates accepted",
        "Physical roots, nonempty claims/generation, model and effort validated"
      ],
      "postconditions": [
        "Every must-have verified in CODE_DIR; scoped output and criterion evidence returned"
      ],
      "tests": [
        "scripts/forge-task-execution.test.js"
      ]
    },
    {
      "id": "verification",
      "path": "shared/forge-procedure-verification.md",
      "sha256": null,
      "status": "pending",
      "owner": "T02",
      "dependencies": [
        "core"
      ],
      "preconditions": [
        "Exact plan and actual code root identified",
        "Concrete applicable checks resolved without inventing commands"
      ],
      "postconditions": [
        "Outcomes, skips and declared-artifact evidence captured independently"
      ],
      "tests": [
        "scripts/forge-verify.test.js"
      ]
    },
    {
      "id": "completion",
      "path": "shared/forge-procedure-completion.md",
      "sha256": "a47fbb61bcb8a3ad7014e08942e5ffca701a645b83f955a9acd9c2e4eb80c5f9",
      "status": "ready",
      "owner": "T02",
      "dependencies": [
        "core"
      ],
      "preconditions": [
        "Task/slice summaries, deliveries and review findings preserved",
        "Verification and protected branch guard remain applicable"
      ],
      "postconditions": [
        "Delivery facts, UAT gaps and canonical owner publication remain separate"
      ],
      "tests": [
        "scripts/forge-prompt.test.js"
      ]
    },
    {
      "id": "memory",
      "path": "shared/forge-procedure-memory.md",
      "sha256": null,
      "status": "pending",
      "owner": "T04",
      "dependencies": [
        "core"
      ],
      "preconditions": [
        "Eligible problem/plan query and unit identity kept separate",
        "Canonical memory selector and explicit availability retained"
      ],
      "postconditions": [
        "Extraction uses its own envelope; no inferred publication from provider success"
      ],
      "tests": [
        "scripts/forge-procedure-callers.test.js"
      ]
    },
    {
      "id": "recovery",
      "path": "shared/forge-procedure-recovery.md",
      "sha256": null,
      "status": "pending",
      "owner": "T04",
      "dependencies": [
        "core"
      ],
      "preconditions": [
        "Inspect process and receipt before retry",
        "Functional answers, live standing authority and historical budget preserved"
      ],
      "postconditions": [
        "Replay valid saved output or reconcile every writer root before an untried valid route"
      ],
      "tests": [
        "scripts/forge-procedure-callers.test.js"
      ]
    },
    {
      "id": "review",
      "path": "shared/forge-procedure-review.md",
      "sha256": null,
      "status": "pending",
      "owner": "T05",
      "dependencies": [
        "core"
      ],
      "preconditions": [
        "Configured review models and scope resolved independently of execution tiers",
        "Scoped correction claims and current findings retained"
      ],
      "postconditions": [
        "Sanitized diagnostic and actual verdict/correction outcomes preserved without invented fallback"
      ],
      "tests": [
        "scripts/forge-xllm-review-cli.test.js"
      ]
    },
    {
      "id": "distribution",
      "path": "shared/forge-procedure-distribution.md",
      "sha256": null,
      "status": "pending",
      "owner": "T06",
      "dependencies": [
        "core"
      ],
      "preconditions": [
        "Canonical source inventory and module digests validated",
        "Both host renderers exercised only in temporary roots"
      ],
      "postconditions": [
        "Installed content resolves the same core/modules with explicit availability and hashes"
      ],
      "tests": [
        "scripts/forge-source-manifest.test.js"
      ]
    },
    {
      "id": "preparation",
      "path": "shared/forge-procedure-preparation.md",
      "sha256": "aeffaf044f47b8787fcf30812bb3a8efacbc349292ee4bff2b829537f4c7d728",
      "status": "ready",
      "owner": "T02",
      "dependencies": [
        "core"
      ],
      "preconditions": [
        "Matching project, scope and accepted decisions available",
        "Functional pending questions retained by stable ID"
      ],
      "postconditions": [
        "Scoped discuss/research artifacts returned for owner validation/publication"
      ],
      "tests": [
        "scripts/forge-prompt.test.js"
      ]
    }
  ],
  "phases": [
    {
      "id": "boot",
      "modules": [
        "personal"
      ],
      "consumers": [
        "skills/forge-auto/SKILL.md",
        "skills/forge-next/SKILL.md"
      ],
      "owner": "T04",
      "preconditions": [
        "Read-only personal snapshot and explicit own-work selection",
        "Preserve accepted decisions and unresolved personal diagnostics"
      ],
      "postconditions": [
        "Only the selected own unit advances; no colleague discovery or implicit binding"
      ],
      "tests": [
        "scripts/forge-procedure-context.test.js",
        "scripts/forge-procedure-callers.test.js"
      ]
    },
    {
      "id": "personal-selection",
      "modules": [
        "personal"
      ],
      "consumers": [
        "skills/forge-auto/SKILL.md",
        "skills/forge-next/SKILL.md"
      ],
      "owner": "T04",
      "preconditions": [
        "Read-only personal snapshot and explicit own-work selection",
        "Preserve accepted decisions and unresolved personal diagnostics"
      ],
      "postconditions": [
        "Only the selected own unit advances; no colleague discovery or implicit binding"
      ],
      "tests": [
        "scripts/forge-procedure-context.test.js",
        "scripts/forge-procedure-callers.test.js"
      ]
    },
    {
      "id": "discuss-milestone",
      "modules": [
        "preparation"
      ],
      "consumers": [
        "scripts/forge-prompt.js",
        "scripts/forge-unit-sidecar.js"
      ],
      "owner": "T02",
      "preconditions": [
        "Matching project, scope and accepted decisions available",
        "Functional pending questions retained by stable ID"
      ],
      "postconditions": [
        "Scoped discuss/research artifacts returned for owner validation/publication"
      ],
      "tests": [
        "scripts/forge-procedure-context.test.js",
        "scripts/forge-prompt.test.js"
      ]
    },
    {
      "id": "discuss-slice",
      "modules": [
        "preparation"
      ],
      "consumers": [
        "scripts/forge-prompt.js",
        "scripts/forge-unit-sidecar.js"
      ],
      "owner": "T02",
      "preconditions": [
        "Matching project, scope and accepted decisions available",
        "Functional pending questions retained by stable ID"
      ],
      "postconditions": [
        "Scoped discuss/research artifacts returned for owner validation/publication"
      ],
      "tests": [
        "scripts/forge-procedure-context.test.js",
        "scripts/forge-prompt.test.js"
      ]
    },
    {
      "id": "research-milestone",
      "modules": [
        "preparation"
      ],
      "consumers": [
        "scripts/forge-prompt.js",
        "scripts/forge-unit-sidecar.js"
      ],
      "owner": "T02",
      "preconditions": [